{
  "schemaVersion": 1,
  "id": "frozen-heart.pt-br",
  "version": "1.0.2",
  "name": {
    "pt-BR": "Frozen Heart em Português (Brasil)",
    "en": "Frozen Heart in Brazilian Portuguese",
    "es": "Frozen Heart en portugués de Brasil"
  },
  "description": {
    "pt-BR": "Tradução comunitária dos textos de Frozen Heart para português do Brasil.",
    "en": "Community translation of Frozen Heart text into Brazilian Portuguese.",
    "es": "Traducción comunitaria de los textos de Frozen Heart al portugués de Brasil."
  },
  "author": "dev",
  "gameProjectId": "frozen_heart",
  "gameVersion": "v1.1.5",
  "sourceLanguage": "en",
  "targetLanguage": "pt-BR",
  "minimumLauncherVersion": "0.17.48",
  "textsFile": "texts.json",
  "textsSha256": "6a1f4658330db6ccfd6713dcbafcdf3bdb4231f456897c9741eeae880ebc9850"
}
