{
  "schemaVersion": 1,
  "id": "plugged-dream.pt-br",
  "version": "1.0.2",
  "name": {
    "pt-BR": "Plugged Dream em Português (Brasil)",
    "en": "Plugged Dream in Brazilian Portuguese",
    "es": "Plugged Dream en portugués de Brasil"
  },
  "description": {
    "pt-BR": "Tradução comunitária dos textos de Plugged Dream para português do Brasil.",
    "en": "Community translation of Plugged Dream text into Brazilian Portuguese.",
    "es": "Traducción comunitaria de los textos de Plugged Dream al portugués de Brasil."
  },
  "author": "dev",
  "gameProjectId": "plugged_dream",
  "gameVersion": "v1.3.0",
  "sourceLanguage": "en",
  "targetLanguage": "pt-BR",
  "minimumLauncherVersion": "0.17.48",
  "textsFile": "texts.json",
  "textsSha256": "f9eea1481024a26b1df4c3e108deb3625fb3f4743c470b56fb969befde734053"
}
