{
  "schemaVersion": 1,
  "id": "vs-kris.pt-br",
  "version": "1.0.2",
  "name": {
    "pt-BR": "VS Kris em Português (Brasil)",
    "en": "VS Kris in Brazilian Portuguese",
    "es": "VS Kris en portugués de Brasil"
  },
  "description": {
    "pt-BR": "Tradução comunitária dos textos de VS Kris para português do Brasil.",
    "en": "Community translation of VS Kris text into Brazilian Portuguese.",
    "es": "Traducción comunitaria de los textos de VS Kris al portugués de Brasil."
  },
  "author": "dev",
  "gameProjectId": "vs_kris",
  "gameVersion": "v1.0.0",
  "sourceLanguage": "en",
  "targetLanguage": "pt-BR",
  "minimumLauncherVersion": "0.17.48",
  "textsFile": "texts.json",
  "textsSha256": "374eb2c300d605d655599bbb4f75a66a6c7bd9f0490a0590a698cedb6bed070a"
}
