{
  "schemaVersion": 1,
  "id": "crockerplayable.es",
  "version": "1.0.1",
  "name": {
    "pt-BR": "Crockerfan08's Chapter 6 em Espanhol",
    "en": "Crockerfan08's Chapter 6 in Spanish",
    "es": "Crockerfan08's Chapter 6 en Español"
  },
  "description": {
    "pt-BR": "Tradução comunitária dos textos de Crockerfan08's Chapter 6 para espanhol.",
    "en": "Community translation of Crockerfan08's Chapter 6 text into Spanish.",
    "es": "Traducción comunitaria de los textos de Crockerfan08's Chapter 6 al español."
  },
  "author": "dev + IA",
  "gameProjectId": "crockerplayable",
  "gameVersion": "v1.0.3",
  "sourceLanguage": "en",
  "targetLanguage": "es",
  "minimumLauncherVersion": "0.17.48",
  "textsFile": "texts.json",
  "textsSha256": "96bde464d71741e53d6bfb22e22ac9d7f89b5462a3b2172339bebf03e5baee8c"
}
